,docId,sourceName,title,summary,Nhãn
1637,1805b23cadb08f0b69dde88875080a92,Phunutoday,"Sửa quạt thừa dầu nhớt, dầu máy đừng vội bỏ mà làm ngay cách này đảm bảo chuột nối đuôi nhau chạy ""té khói""","( PHUNUTODAY ) - Bạn có biết đến mẹo đuổi chuột vô cùng hiệu quả bằng dầu nhớt dầu máy này? Chuột đặc biệt ""ghét"" dầu nhớ dầu máy, giống như ""kẻ thù không đội trời chung"".",0
1638,7e82aa9033318628f2dd66788910eb94,Kinh Te Moi Truong,Dự báo thời tiết ngày 2/5: Không khí lạnh tiếp tục ảnh hưởng nhiều nơi,"Không khí lạnh đã ảnh hưởng đến một số nơi ở Trung Trung Bộ. Vịnh Bắc Bộ đã có gió Đông Bắc mạnh cấp 7, giật cấp 9, biển động mạnh.",0
1639,506b57097dfa30bf74739b1327d1bd41,Thanh Niên,"Tin tức thời tiết hôm nay, 17.4.2022: Không khí lạnh lan rộng, mưa lớn","Tin tức thời tiết hôm nay, 17.4.2022, không khí lạnh tăng cường mạnh hơn và ảnh hưởng đến các nơi khác ở phía Tây Bắc bộ, Bắc Trung bộ và một số nơi ở Trung Trung bộ. Mưa lớn ở Bắc bộ, Bắc Trung bộ.",0
1640,438a1ba8ef3a48efb1c16986bf73486c,Việt Giải Trí,Ban tổ chức thông báo ngày khai mạc VCS Mùa Hè 2022,"BTC đã chính thức thông báo ngày khai mạc của VCS Mùa Hè 2022, nhưng fan dự đoán VCS sẽ được tổ chức online và không khí sẽ bị “giảm nhiệt”.",0
1641,925c7097d07c76fa3cf63414e3ca2597,Thời đại,3.000 sinh viên Việt Nam - Lào - Campuchia tại TP.HCM giao lưu văn hoá và đón Tết cổ truyền,"Sáng ngày 16/4/2022, Lễ hội Tết Cổ truyền và giao lưu văn hóa Việt Nam - Lào - Campuchia 2022 đã diễn trong một không khí tươi vui, hữu nghị.",0
1642,6dbccecd2c009c6d2f2f42b5651a1fe9,eva,"Vào bếp nấu ăn, Tăng Thanh Hà vẫn mách chị em bảo vệ mái tóc, vừa đẹp lại còn vệ sinh",Tăng Thanh Hà vừa điểm tô cho mái tóc lẫn bảo vệ chúng khỏi tác nhân khói và lửa trong khu vực bếp.,0
1643,068d9731b7bca0255ff6df44fb12e7cd,Phunutoday,"Bếp nơi tụ tài đón lộc: Cứ trồng 5 loại cây này tiền bạc ào ào chảy vào nhà, người giàu làm từ lâu","( PHUNUTODAY ) - Nếu bạn muốn chiêu tài đón lộc cho gia đình mình thì đừng quên trong những loại cây dưới đây ở trong bếp, vừa giúp thanh lọc không khí vừa hợp phong thủy.",0
1644,ab819e2d4f14b3501ff166780b198dd2,Lối sống thành thị,"Đấu Trường Ngôi Sao: Phương Trinh Jolie khóc nức nở, chạy lên sân khấu ôm lấy thành viên đội","Mở màn cho đêm chung kết đầu tiên, bộ ba đội trưởng quen thuộc của Đấu Trường Ngôi Sao 2022 đã mang tới một không khí vô cùng sôi động và hứng khởi với món quà âm nhạc mang tên Hãy Đến Với Anh. Vũ điệu cuốn hút cùng giọng hát hòa quyện của Lâm Vũ, Nam Cường và Phương Trinh Jolie đã mang tới một khởi đầu nhiều năng lượng cho vòng chung kết của Đấu Trường Ngôi Sao.",0
1645,ff3cf8805b3fb8980b045ab6670d0b4b,Cư dân mạng,Hàng ngàn CĐV đội mưa cổ vũ U23 Việt Nam đấu U23 Philippines,"(Tổ Quốc) - Các CĐV Việt Nam đã đem đến không khí cổ động tuyệt vời trên sân Việt Trì, Phú Thọ tối 8/5.",0
1646,46671d1562d0325f370caa15bb0f4168,"top list, top 10, top ten, danh sach top",Top 10 Thương hiệu bia nổi tiếng nhất Việt Nam,"Bạn sẽ ngạc nhiên khi biết rằng theo thống kê của Bộ Y tế thì Việt Nam nằm trong số các quốc gia tiêu thụ bia nhiều nhất thế giới, đứng hàng thứ ba tại châu Á. Trong không khí rộn ràng của ngày tết cận kề, có lẽ số lượng bia tiêu thụ sẽ tăng vọt đáng kể. Tôi không phủ nhận ưu và khuyết điểm do loại đồ uống có cồn này mang lại mà chỉ muốn chia sẻ với các bạn những thương hiệu bia nào nổi tiếng nhất tại Việt Nam. Điều đó cũng khá thú vị.",0
1647,b074f4c47eab49b6df900eb93ff6287d,Công an Thành phố Hồ Chí Minh,4 người mắc kẹt trong căn nhà 5 tầng bị khói lửa bủa vây được giải cứu,(CAO) Lực lượng chức năng cùng người dân đã nhanh chóng tiếp cận vụ việc và kịp thời cứu được 4 người ra khỏi vụ hỏa hoạn trong căn nhà 5 tầng giữa phố trong đêm.,0
1648,2431744986e143671d4cb737c9e681e0,Kênh 14,"Ảnh: ""Biển người"" ken đặc ở chợ đêm Đà Lạt trong tối đầu tiên của kỳ nghỉ lễ 10/3, một số nơi không còn chỗ gửi xe","Tối ngày 9/4, hàng nghìn du khách đổ về chợ đêm Đà Lạt tạo nên không khí vô cùng đông đúc, nhộn nhịp.",0
1649,35812fa7d8ad7afaa596584277bcdce6,Viettel Media,"Nhân viên dọn dẹp khách sạn tiết lộ: Đây là những đồ bẩn nhất trong khách sạn, thậm chí có thể có cặn chất lỏng không rõ nguồn gốc, cố gắng không sử dụng","Bây giờ điều kiện sống của chúng ta tốt hơn, khi chúng ta không có gì để làm, chúng ta muốn đi du lịch một chuyến 'chỉ để đi' khám phá và thay đổi không khí. Và khi chúng ta đi du lịch thì việc ở trong khách sạn là điều không thể thiếu.",0
1650,c524bea2cb702a2bbb506a52dc5ed6b0,Tuổi trẻ online,"Về Tịnh Biên - An Giang leo núi Cấm, ngắm hoàng hôn trên cánh đồng thốt nốt","TTO - Được mệnh danh là ""Đà Lạt của miền Tây"", đến với Tịnh Biên, du khách không chỉ được tận hưởng bầu không khí trong lành, mát mẻ, mà còn được khám phá nhiều cảnh đẹp hùng vĩ, nên thơ.",0
1651,f876d376dbbd18f95c5ab0ac92d79de6,Bảo vệ pháp luật,Miền Bắc mưa dông trước khi chuyển rét dịp nghỉ lễ,"(BVPL) - Dự báo thời tiết ngày 29/4, miền Bắc hôm nay mưa rải rác, có nơi có dông, mưa đá, gió giật mạnh trước khi đón đợt không khí lạnh vào ngày 30/4.",0
1652,a03e95fb6770adb383307f35df2b1b86,Trang tin điện tử thời mới,"Bắc bộ trời rét, nhiều nơi xuống 12 độ C","Không khí lạnh cường độ khá mạnh đã bao trùm toàn Bắc bộ, gây ra một đợt rét Nàng Bân ngắn ngày.",0
1653,8ebcf5b0fc0ce5554ba4432487084281,chovinh,Máy hút ẩm Thái Lan Harison HD-45BE giá tốt toàn quốc,"Máy hút ẩm Harison HD-45BE được sử dụng trong gia đình để kiểm soát độ ẩm trong không khí cho các phòng có diện tích trên dưới 50m2, sử dụng nhiều cho...",0
1654,be139b9098e85e6ca2487018c3c5b688,Tuổi trẻ online,U19 Việt Nam tan mộng vô địch sau thất bại 0-3 trước Malaysia,"TTO - Chiều 13-7, giấc mộng vô địch của U19 Việt Nam đã tan thành mây khói khi để thua Malaysia 0-3 ở bán kết Giải U19 Đông Nam Á 2022 tổ chức ở Indonesia.",0
1655,b5624cde755de6cbec024707e158a0dd,Thể thao Việt Nam,Vệ sinh bảo dưỡng máy lạnh bao nhiêu tiền,"Những lý do bạn nên bảo dưỡng điều hòa trước mùa hè
Điều hòa không khí là điều được nghĩ đến đầu tiên trong những ngày nóng bức đầu tiên của mùa hè để...",0
1656,5c6f4dbad468a449679f8a7a93d2275c,Ninh Thuận Online,"Giữ gìn “mắt sáng, lòng trong, bút sắc”","Ra đời trong khói lửa các cuộc kháng chiến giải phóng dân tộc, trưởng thành cùng bao thăng trầm của đất nước, lớp lớp những người làm báo đã làm nên truyền thống vẻ vang, đáng tự hào của Báo chí Cách mạng Việt Nam. Điều sâu sắc nhất, thiêng liêng nhất, đó là làm báo là làm cách mạng, làm báo là để phục vụ đất nước và Nhân dân, đúng như lời Bác Hồ căn dặn: “Cán bộ báo chí cũng là chiến sĩ cách mạng. Cây bút, trang giấy là vũ khí sắc bén của họ”.",0
1657,5d4485c4589e78ae8e7f03d0b86d686a,Cổng thông tin điện tử tỉnh Thừa Thiên Huế,Quảng Điền khẩn trương triển khai các biện pháp khắc phục lúa bị đổ ngã vụ,"Vụ lúa Đông Xuân năm 2021-2022 toàn huyện đưa vào gieo cấy 4.250 ha lúa. Sau những thiệt hại do trận mưa lũ vào cuối tháng 3, huyện Quảng Điền đã chỉ đạo các cơ quan, ban ngành các xã, thị trấn đẩy nhanh tiến độ chăm sóc lúa theo đúng quy trình kỹ thuật. Đến thời điểm hiện nay toàn diện tích lúa đã chín rộ, tuy nhiên do ảnh hưởng của đợt không khí lạnh vào các ngày cuối tháng 4 và đầu tháng 5, mưa to kèm theo gió lớn đã làm nhiều diện tích ruộng lúa bị đổ ngã, qua thống kê toàn huyện có 1.120 ha lúa bị đổ ngã, trong đó nặng nhất ở các địa phương như Quảng Thái, Quảng Vinh, Quảng An và Quảng Thành.",0
1658,b506294f370f1e98976d4afa1a6a9876,Thế giới điện ảnh,"Seo Ye Ji chăm chỉ, Park Byung Eun dễ thương trong hậu trường ‘Eve’","(TGĐA) - Đoàn phim Eve mới đây đã tiết lộ hậu trường mới thú vị trái ngược với bầu không khí căng thẳng, nặng nề trên phim.",0
1659,72a074f673a1a3012ad7c42cbc1aa7c0,Báo Đồng Nai,Pháp tổ chức bầu cử Quốc hội vòng 2,"Ngày 19-6, nước Pháp bước vào vòng 2 cuộc bầu cử Quốc hội khóa XVI của nền Đệ ngũ Cộng hòa trong bầu không khí ",0
1660,adf8715860a217646bd77c49435c7fe9,"top list, top 10, top ten, danh sach top","Top 7 Homestay đẹp, yên tĩnh nhất ngoại thành Đà Nẵng","Quá mệt mỏi, chán nản với những con đường đầy ắp xe cộ, với tiếng còi xe luôn inh ỏi bên tai, hay thậm chí là những áp lực trong cuộc sống và công việc, con người ta thường có xu hướng “chạy trốn” về những nơi yên tĩnh, nhẹ nhàng, thả hồn mình vào cuộc sống xung quanh. Chính vì thế, homestay cùng bầu không khí yên bình, tách biệt khỏi những ồn ào của thành phố là một địa chỉ lý tưởng dành cho bạn. Dưới đây là những homestay nổi tiếng mà không ít bạn đã lựa chọn ở ngoại thành của thành phố Đà Nẵng.",0
1661,1822fd8501640ec566ac83f511890869,24h,"""Giải mã"" tội ác kinh hoàng vụ người đàn ông mất tích bí ẩn: Bao tải nổi ven sông","Người đàn ông nhẹ nhàng khua mái chèo đưa con thuyền nhỏ đi dọc sông Văn Úc. Khi tới khu vực cống Gừng, sát mép nước, một bao tải nổi lập lờ bốc mùi khó chịu. Khi người này nhìn kỹ, dường như bên trong bao tải ấy có chứa một thi thể người.",0
1662,53296a25ced6b937785897b6631e86fb,Thanh Niên,"Lãi đậm, lãi khủng nhờ sách giáo khoa: Siêu lợi nhuận là tất yếu","Năm 2021 dịch Covid-19 'càn quét' nhiều tỉnh thành phố nước ta khiến không ít ngành sản xuất, kinh doanh suy kiệt vậy mà Nhà xuất bản Giáo dục Việt Nam 'vô nhiễm' khi báo cáo kinh doanh lãi đậm chủ yếu nhờ phát hành sách giáo khoa.",0
1663,b2f75665dc343050d031c1531268b79e,cafebiz,"CĐV Đông Nam Á phát sốt trước hình ảnh có ""1-0-2"" ở trận U23 Malaysia thắng U23 Thái Lan",Các khán giả tại SVĐ Thiên Trường đã tạo ra bầu không khí sôi động khiến CĐV Đông Nam Á dành cơn mưa lời khen.,0
1664,7b6ba6cbd5380785b7bcbfb96dc87812,Phunutoday,Top 5 loài cây trồng trong nhà vừa đem lại tài lộc vừa mang lại sức khỏe cho gia đình,( PHUNUTODAY ) - Cây xanh không những giúp không gian sống gần gũi với tự nhiên mà còn đem lại nguồn không khí trong lành cho gia đình. Dưới dây là 5 loài cây vừa đem lại lại tài lộc cho gia chủ vừa giúp ích rất nhiều cho sức khỏe.,0
1665,8261bba1bb0074cedd72cb546cf9e834,Viettel Media,"Clip: Múa phụ họa cho cô giáo hát, nam sinh gây bão với thần thái lầy lội khiến cả trường cười không ngớt","Màn múa phụ họa có 1-0-2 của nam sinh khiến cả trường được phen cười ngất. Những biểu cảm bá đạo, lắc lư theo nhịp khiến không khí toàn trường càng thêm rộn ràng.",0
1666,a274bcf122777dc8adc8ed45138f21fd,TRANG THÔNG TIN ĐIỆN TỬ CỦA VPUBND TỈNH BÌNH ĐỊNH,Giao hữu bóng đá nam giữa VPUB tỉnh và Sở Xây dựng,"Hấp dẫn, sôi nổi và không kém phần kịch tính là không khí của trận đấu giao hữu bóng đá chiều ngày 26/4, giữa VPUB tỉnh và Sở Xây dựng, chào mừng Ngày Giải phóng Miền Nam 30/4 và Quốc tế Lao động 1/5.",0
1667,1381bf79d00dcb5704858f4959046192,Việt Giải Trí,6 kiểu tóc nhuộm màu rêu khói sáng da hot nhất 2022: Vừa sang vừa “tây”,,0
1668,4c551e87933ba16ae208d0fc05d04123,Hà Nội mới,Phát hiện 4.688 vụ vi phạm các quy định về bảo vệ và phát triển rừng,"(HNM) - Theo Bộ NN& PTNT, từ đầu năm đến nay, công tác bảo vệ và phòng, chống cháy rừng được các cấp, ngành đặc biệt quan tâm. Do thời tiết hanh khô, nắng nóng kéo dài trên diện rộng dẫn đến cháy rừng tại một số địa phương, nhưng mức độ thiệt hại giảm.",-1
1669,9a43a0deb1e22369c01bf6045530d98c,Phòng không - không quân,Để đạt kết quả tốt tại diễn tập,"Đến Tiểu đoàn 55 (Trung đoàn 267, Sư đoàn 365) những ngày này, chúng tôi được hòa mình vào bầu không khí sôi nổi, quyết tâm cao trong huấn luyện của cán bộ, chiến sĩ chuẩn bị tham gia Diễn tập phân đội kỹ thuật tên lửa phòng không S-75M năm 2022 do Quân chủng Phòng không - Không quân tổ chức trong thời gian tới.",0
1670,188e5049e9bb3c3e12804db94883a0ff,Cổng thông tin điện tử tỉnh Thừa Thiên Huế,"Chủ động ứng phó với những diễn biến của không khí lạnh, dông, lốc, sét và gió mạnh trên biển","Ngày 15/04, Ban Chỉ huy phòng chống thiên tai và tìm kiếm cứu nạn (PCTT&TKCN) tỉnh đã ban hành thông báo số 76 /TB-PCTT về việc cảnh báo, ứng phó với không khí lạnh, dông, lốc, sét, gió mạnh trên biển.",0
1671,64c4e6122feb1f56ad769e0ab28b49f0,Báo Thái Bình,SEA Games 31: Hà Nội sẵn sàng đón ngày hội lớn của thể thao Đông Nam Á,"Đến thời điểm giữa tháng 4/2022, không khí chuẩn bị cho Đại hội Thể thao Đông Nam Á (SEA Games) lần thứ 31 tại Hà Nội đang diễn ra sôi động.",0
1672,b001fe4de6f721046555ca4979972c77,Xã luận,Cổ phiếu của GoTo tăng hơn 20% trong ngày đầu IPO,"Giá cổ phiếu của siêu ứng dụng GoTo đã tăng 21% trong lần đầu tiên ra mắt thị trường chứng khoán (IPO) hôm 11-4 ở Indonesia. Hơn 300.000 nhà đầu tư đã tham gia phiên IPO, mức kỷ lục ở thị trường chứng khoán nội địa. Giới phân tích nhận định đây là khởi đầu tích cực bởi trước đó là không khí ảm đạm trong lĩnh vực công nghệ Đông Nam Á, làm giảm hứng thú của giới đầu tư.",0
1673,9a42fb4eee57080b9b7751ea13306017,Xã luận,Vạn người nối nhau đổ về Đền Hùng trước ngày Giỗ Tổ,"Hàng vạn du khách đã tìm đến Khu di tích lịch sử Đền Hùng (tỉnh Phú Thọ) trong ngày đầu nghỉ lễ khiến không khí tại đây nhộn nhịp, tấp nập khác lạ so với ngày thường.",0
1674,25492ab9452536b3157df6f14d6819b8,Kênh 14,"NÓNG: Cháy lớn trên cao tốc TP.HCM - Trung Lương, cột khói cuồn cuộn khiến nhiều người khiếp sợ","Vụ hỏa hoạn xảy ra lúc 12h40 ngày 4/5, tại Km37+550 hướng phải tuyến Cao tốc TP.HCM - Trung Lương, đoạn qua ấp Cầu Tre, xã Lợi Bình Nhơn, TP.Tân An, tỉnh Long An.",-1
1675,51806ba5ccf54bab904a3bc8af7da4fc,Báo điện tử trí thức trẻ - Tin tức nhanh nhất,Caster Bomman: “Chung kết VCT 2022 - Stage 2 Challengers VN chính là không khí nên có của các giải Esports chuyên nghiệp!”,"(Tổ Quốc) - Trở lại thi đấu offline sau thời gian dài trì hoãn, vòng Play-offs của VCT 2022 - Stage 2 đã thu hút được sự chú ý của rất nhiều các game thủ trên toàn quốc.",0
1676,57c5a0b89db4203808f6715e27d451f6,VietNam Plus,"Không khí lạnh yếu gây mưa rào và dông ở Bắc Bộ, Bắc Trung Bộ","Khoảng đêm 17/4 đến ngày 18/4, không khí lạnh được tăng cường mạnh hơn và sau đó ảnh hưởng đến các nơi khác ở phía Tây Bắc Bộ, Bắc Trung Bộ và một số nơi ở Trung Trung Bộ.",0
1677,c6c7dff33e295ad69f8c5d20e3fcf642,Báo điện tử đài tiếng nói Việt Nam,"Thời tiết ngày 17/4: Không khí lạnh tăng cường, Miền Bắc mưa rất to","VOV.VN - Ngày 17/4, các tỉnh, thành miền Bắc có mưa to đến rất to; không khí lạnh được tăng cường mạnh hơn. Khu vực miền Trung, Tây Nguyên và Nam Bộ tiếp tục xảy ra mưa giông vào chiều tối.",0
1678,a6db8c48b297e0e54e298406764d374c,Việt Giải Trí,‘Shooting Stars’ tập 4: Kim Young Dae ghen ‘tóe khói’ khi thấy Lee Sung Kyung được trai đẹp ‘thả thính’,"Có vẻ như anh chàng luật sư đẹp trai của công ty đã bắt đầu thích Han Byeol rồi, Tae Sung có tình địch đáng gờm đây!",0
1679,eed4fe5a70616266bbcd05149e3d9556,Bóng đá số,Phố đi bộ 'say' bóng đá cổ vũ U23 Việt Nam,"Tối mùng 8/5, các CĐV của U23 Việt Nam đã đổ xuống phố đi bộ Nguyễn Huệ hòa chung vào không khí SEA Games 31…",0
1680,a525fb42339b9cb20d1b871bc76b0d62,vnexpress,"TP HCM, Hà Nội có thể mưa lớn tối 30/4","Vùng áp thấp trên Biển Đông hoạt động mạnh, có thể gây mưa to ở TP HCM tối nay. Hà Nội cũng mưa giông do ảnh hưởng của không khí lạnh.",0
1681,0d2dc0d70842860ccdf834e3e3303ca6,Otofun new,Những hình ảnh đáng nhớ trong tiệc tổng kết sự kiện Xếp xe kỷ lục hình bản đồ Việt Nam,"Bữa tiệc tri ân các tình nguyện viên và nhà tài trợ sự kiện Xếp xe kỷ lục hình bản đồ Việt Nam diễn ra trong không khí đầm ấm tại Ngô Quyền, Hải Phòng.",0
1682,86c3bd8e58aec2778a8263147a27bc91,Báo Đồng Nai,Những lời tri ân!,"Những ngày tháng 6 vừa qua, đội ngũ những người làm báo cả nước nói chung và Đồng Nai nói riêng đã được sống trong không khí vui tươi, phấn khởi bởi sự quan tâm, tình cảm nồng ấm, chân thành của các cấp, ngành và công chúng dành cho giới báo chí nhân kỷ niệm 97 năm Ngày Báo chí cách mạng Việt Nam. Báo Đồng Nai điện tử, Cơ quan của Đảng Bộ, chính quyền và nhân dân tỉnh Đồng Nai",0
1683,79245110b6d39870f9d3804651e2d1fd,Thể thao Việt Nam,Cách chọn bơm nước cho chiller và tháp giải nhiệt?,"Máy bơm nước cho hệ thống điều hòa không khí và tháp giải nhiệt

 Máy bơm nước giúp làm mát hệ thống điều hòa, hay cụ thể hơn là hệ thống điều hòa...",0
1684,9f1bf9dfaba82dd45ec65456f7381d77,Viettel Media,"Ngọc Hân lần đầu tham gia giải chạy, hội ngộ Á hậu Hoàng My","Cùng với hàng trăm runner khác, 3 người đẹp đã chinh phục các chặng đường 5km, 10km, vừa rèn luyện thể thao, vừa tận hưởng không khí trong lành của rừng Cúc Phương.",0
1685,9c284cf38d2bc357ffbd87cf0853e336,Báo điện tử trí thức trẻ - Tin tức nhanh nhất,"Hà Nội: Cháy lớn trên phố Đê La Thành, khói đen bốc cao hàng chục mét","(Tổ Quốc) - Trưa 16/4, lửa bất ngờ bốc lên từ tầng 8 khu chứa đồ tại một quán massage tắm lá trên phố Đê La Thành.",-1
1686,1f7562c9fa8e0160d083e80523b762d9,Công Luận,"Tiệm massage trên phố Đê La Thành cháy lớn, cột khói ngụt ngùn cả bầu trời",,-1
1687,42de118cddea0b483d9829a7f9e08cb8,vnexpress,LIV Golf Invitational Series kiểm soát rượu bia ở Portland,"MỹChủ tương tạo bầu không khí hội hè trong ba ngày diễn ra sự kiện tại Portland, nhưng LIV Golf vẫn bố trí nhân sự kiểm soát bia rượu vì chính quyền sở tại yêu cầu.",0
1688,272999cf6dedd449288714310ed577e5,Xã luận,"Ra quân lập lại trật tự giao thông, mỹ quan đô thị xung quanh chợ Phước Thái","Lâu nay, các tuyến đường xung quanh chợ Phước Thái gồm: Võ Thị Sáu, Trường Sa, Hoàng Sa, Phước Long… thường xuyên bị các hộ kinh doanh lấn chiếm lòng, lề đường để buôn bán, xả nước thải, rác thải gây ô nhiễm môi trường, làm mất mỹ quan đô thị; đậu đổ xe ở lòng, lề đường gây cản trở giao thông. Do vậy, việc lập lại trật tự an toàn giao thông, mỹ quan đô thị ở khu vực này là rất cần thiết, được người dân đồng tình hưởng ứng, tạo sự thông thoáng, sạch đẹp phố phường.",0
1689,e652cedc4368df4a086ebf4e327c8509,cafeland,“Rực lửa” tại lễ ra quân dự án Phúc An Ashita,Lễ ra quân dự án Phúc An Ashita với chủ đề ấn tượng “Khát vọng chiến binh – Chuẩn tinh thần Nhật” đã được diễn ra trong không khí sôi động tại TP.HCM vào sáng 19/4.,0
1690,cdb9e4634bc510aeb9b23678fd5fb080,VTC news,"Thời tiết ngày 20/4: Miền Bắc tăng nhiệt, miền Nam mưa dông rải rác","Dự báo thời tiết hôm nay (20/4), không khí lạnh suy yếu dần, Bắc Bộ nhiệt độ tăng nhanh, có nơi 27 độ C, trong khi đó Nam Bộ vẫn đón mưa dông rải rác.",0
1691,497170145a85edaffcf704ef6efb31b7,24h,"Khó thở, hụt hơi – dấu hiệu cảnh báo mức độ trào ngược đang xấu dần","Bạn luôn ở trong trạng thái phải cố gắng thở sâu hay mở miệng lớn để hít thật nhiều không khí vào nhưng cũng không cải thiện được tình trạng khó thở, hụt hơi của mình. Điều này ảnh hưởng không nhỏ tới cuộc sống mà còn là dấu hiệu cho thấy tình trạng trào ngược dạ dày của bạn đang trở nặng.",0
1692,91024dc85a58deab38584d4facc22577,Xã luận,Cần sớm bồi thường về những diện tích hoa màu bị khí thải làm hư hại ở Lào Cai,"Sau 3 tuần kể từ khi xảy ra sự cố táp lá cây trồng diện rộng, ảnh hưởng đến đời sống, sản xuất của bà con nhân dân quanh khu công nghiệp Tằng Loỏng, huyện Bảo Thắng, tỉnh Lào Cai, việc khắc phục hậu quả vẫn chưa thể giải quyết dứt điểm.",0
1693,1710a6a70449a986b433cb9fed957f89,Tuổi trẻ online,Không khí lạnh và bão tác động thế nào đến thời tiết cả nước dịp lễ 30-4 và 1-5?,TTO - Khả năng không khí lạnh và áp thấp nhiệt đới/bão trên Biển Đông xuất hiện cùng lúc sẽ tương tác gây ra đợt mưa dông trên diện rộng trên khắp cả nước trong dịp nghỉ lễ 30-4 và 1-5.,0
1694,43b7c0fda811572f971aff4682763ce0,Tuần báo văn nghệ,Còn đây khúc Duối đẵn lòng Mang đầy kỉ niệm giấc mong con tìm Cha về khói hắt thoảng im Mơ màng đôi ánh mắt hiền nâng niu,Còn đây khúc Duối đẵn lòng Mang đầy kỉ niệm giấc mong con tìm Cha về khói hắt thoảng im Mơ màng đôi ánh mắt hiền nâng niu,0
1695,5f44b42f5ca15b5bec0d1a20abfc3817,Cổng giao tiếp điện tử thành phố hà Nội,"Tạo không khí vui tươi, phấn khởi trong những ngày diễn ra SEA Games 31 (19:51 06/05/2022)","HNP - Sáng 6/5, Phó Chủ tịch UBND thành phố Hà Nội Chử Xuân Dũng, Trưởng Ban tổ chức Đại hội Thể thao Đông Nam Á lần thứ 31 (SEA Games 31) Thành phố chủ trì phiên họp rà soát các nội dung chuẩn bị tổ chức SEA Games 31. Dự phiên họp còn có các đồng chí Thứ trưởng Bộ Văn hóa Thể thao và Du lịch: Tạ Quang Đông, Hoàng Đạo Cương cùng lãnh đạo các sở, ban, ngành, quận, huyện trên địa bàn Thành phố.",0
1696,dc2996760c99dd15196018b7b8b422bb,phunuvn,Lời khuyên cho bạn khi mua máy lạnh âm trần Daikin,"CÁC TIÊU CHÍ CHÍNH LÀM NÊN THƯƠNG HIỆU MÁY LẠNH ÂM TRẦN DAIKIN
Máy lạnh âm trần Daikin là thương hiệu đi đầu về điều hòa không khí và luôn giữ vững vị trí...",0
1697,4f5964eede203c750b9d6c14c8113f2a,Cư dân mạng,TP.HCM lắp đặt 5 màn hình LED cỡ lớn phục vụ người dân xem SEA Games 31,"(Tổ Quốc) - Hòa chung bầu không khí SEA Games 31, đặc biệt là môn bóng đá nam, TP.HCM đã lắp đặt 5 màn hình LED cỡ lớn trên phố đi bộ Nguyễn Huệ để phục vụ người dân.",0
