,docId,sourceName,title,summary,Nhãn
1047,840982fbf5e9640234dafaba63d9b179,Báo Bà Rịa Vũng Tàu,"Robot cá có thể ""ăn"" vi nhựa trong đại dương","Các nhà khoa học tại Đại học Tứ Xuyên (Trung Quốc) đã phát triển được một robot cá có khả năng hút những mảnh vi nhựa trôi nổi dưới đại dương, trong tương lai có thể giúp giải quyết tình trạng ô nhiễm biển.",0
1048,fc4509d5e19063bed67c5f66cdf2f548,Báo Pháp luật Việt Nam,Hà Nội yêu cầu xử lý toàn bộ rác thải ùn ứ gây ô nhiễm môi trường,,1
1049,8e4cb12d1a575c4d64b038526dcf3619,"top list, top 10, top ten, danh sach top",Top 5 Địa chỉ bán đá khô chất lượng nhất tại Hà Nội,"Đá khô hiện nay không còn là sản phẩm quá xa lạ đối với nhiều người, bởi đây là sản phẩm đang được nhiều người ưa chuộng sử dụng trong công nghiệp và cuộc sống thường nhật như bảo quản thực phẩm, giữ lạnh cho bánh kem, tạo khói sân khấu,… Hiện nay, cũng có nhiều địa chỉ cung cấp loại đá đa dụng này. Cùng toplist khám phá những địa chỉ bán đá khô tốt nhất hiện nay tại Hà Nội nhé",0
1050,5c205355904db24aadd13ed852b7e4e1,Diễn đàn tin học,Thùng rác nhựa nguyên sinh thùng rác 120lit 240lit 0911041000,"ĐÃ PHÁT HIỆN HẠT VI NHỰA TỒN TẠI TRONG CƠ THỂ NGƯỜI 
 
Một lượng lớn rác thải nhựa đang phân tán khắp nơi ngoài môi trường, sau khoảng thời gian rất lâu sau đó, những rác thải nhựa này phân hủy dần thành những mảnh nhựa nhỏ, gọi là vị nhựa, chúng tồn tại ở khắp nơi và từ từ len lỏi vào cơ thể chúng ta một cách thầm lặng. Trong thức ăn, nước uống cũng có thể tồn tại vi nhựa, thậm chí trong cả bầu không khí chúng ta hít thở mỗi ngày.  
 
Sự ảnh hưởng của hạt vi nhựa này đối với cơ thể chúng ta",-1
1051,13d62ca524fa7220c99fd2891ab10500,Báo Đồng Khởi Online,Công an TP. Bến Tre tích cực thực hiện chủ trương “Sáu không”,"BDK - Ngày 5-1-2021, Thành ủy TP. Bến Tre ban hành Nghị quyết số 03-NQ/ThU về thực hiện chủ trương “Sáu không” gồm: không nước thải, rác thải gây ô nhiễm môi trường; không biển hiệu, quảng cáo sai quy định; không để lấn chiếm đường phố trái phép; không để tình hình ma túy diễn biến phức tạp; không để nạn trộm cắp gia tăng; không để tội phạm có tổ chức hoạt động trên địa bàn. Theo chức năng, nhiệm vụ được giao, Công an TP. Bến Tre (CATP) đã xây dựng kế hoạch triển khai thực hiện các nội dung liên quan đến lĩnh vực an ninh trật tự (ANTT) và đã đạt được những kết quả tích cực.",0
1052,a37cea5a9504e1c06e79176e9f196385,Cần thơ tv,Peru ban bố tình trạng khẩn cấp du lịch do COVID-19,"Peru là quốc gia nổi tiếng với nhiều danh lam thắng cảnh và ẩm thực phong phú. Tuy nhiên, ngành du lịch đang chịu ảnh hưởng nghiêm trọng bởi đại dịch COVID-19, buộc chính phủ phải ban bố tình trạng khẩn cấp đối với “ngành công nghiệp không khói” trọng yếu.  ",0
1053,3a2fc6ba950b7adc49045c9da990d391,Báo Cần Thơ Online,Thuốc lá - mối đe dọa tới môi trường của chúng ta,"Ðó là chủ đề Ngày Thế giới không thuốc lá 31-5-2022. Thông qua chủ đề này, Tổ chức Y tế Thế giới (WHO) kêu gọi các quốc gia thúc đẩy các hoạt động nâng cao nhận thức của cộng đồng về tác hại của sử dụng thuốc lá tới môi trường, không hút thuốc lá để hạn chế việc gây ô nhiễm môi trường sống và làm việc.",-1
1054,500e4e7c4be4aba77f060e00d201027f,Hà Nội mới,Dập tắt đám cháy tầng 25 chung cư Hyundai Hillstate,"(HNMO) - Khoảng 17h40 ngày 7-5, tại chung cư Hyundai Hillstate, phố Tô Hiệu, phường Hà Cầu, quận Hà Đông (Hà Nội) xảy cháy. Vị trí đám cháy cùng khói và lửa xuất phát từ tầng cao gần áp chót chung cư khiến nhiều người dân hoang mang.",0
1055,84eafb728e2b9e358895f641a856b858,Kinh Te Moi Truong,Mục tiêu Hậu Giang xanh từ những hành động thiết thực,"Nhiều cơ sở gây ô nhiễm môi trường nghiêm trọng được xóa bỏ, vấn đề môi trường tại tỉnh Hậu Giang ngày càng được cải thiện, thuận tiện cho việc thu hút đầu tư để phát triển kinh tế - xã hội.",0
1056,23e26904cf2e36efacb06ef4ea4ac450,VietNam Plus,Hà Nội yêu cầu xử lý toàn bộ rác thải ùn ứ những ngày qua,"Mặc dù có khu vực, đơn vị thu gom đã che bạt, cho rác vào túi kín nhưng do để lâu ngày rác bị phân hủy nên gây ô nhiễm môi trường, ảnh hưởng đến đời sống của người dân.",-1
1057,493f007068040da2d08b292a3ea8fe80,Xã luận,"Tuần tới sẽ có “bão sao băng” với 1.000 sao mỗi giờ, trái đất có bị ô nhiễm?","Mưa sao băng Tau Herculids có thể thắp sáng bầu trời Bắc Mỹ vào ngày 30 và 31/5. Có khả năng chúng đi qua phần dày nhất của mảnh sao chổi đang tạo ra các mảnh vỡ, trong trường hợp đó bầu trời đêm sẽ tràn đầy các ngôi sao băng.",0
1058,a80a9dea44a85ee68ef32ef8e49e834e,VTC news,"Tuần tới sẽ có 'bão sao băng' với 1.000 sao mỗi giờ, trái đất có bị ô nhiễm?","Nếu hiện tượng này diễn ra như dự báo nó có thể dẫn đến một ""cơn bão sao băng"" với hơn 1.000 ngôi sao băng lao vào Trái Đất mỗi giờ.",0
1059,fe13d772ab179a9a5a1ca259b1b6e639,Vĩnh Phúc Online,Thách thức trong đảm bảo cấp nước đô thị,"Nguồn nước mặt ngày càng ô nhiễm; nguồn nước ngầm dần suy kiệt gây thiếu hụt lượng nước cấp vào mùa khô; khó khăn trong việc thu hút đầu tư, lựa chọn, chuyển đổi mô hình cấp nước tập trung hiện có…là những thách thức Vĩnh Phúc cần giải quyết để đảm bảo an ninh nguồn nước cho phát triển bền vững kinh tế, xã hội.",0
1060,4700a5f9027f9df5db9ce3779b19560a,TẠP CHÍ CÔNG THƯƠNG,Đại hội điểm của Đảng bộ Công ty Than Thống Nhất - TKV,"TCCTVừa qua, Đại hội Chi bộ Phân xưởng Khai thác 7 Công ty Than Thống Nhất - TKV nhiệm kỳ 2022-2025 đã diễn ra trong không khí trang trọng, nghiêm túc.",0
1061,c4e26819b12ca543f0cd64132067efb1,Xã luận,Chùa Từ Đàm Huế: Ngôi chùa cổ Phật giáo nổi tiếng cố đô,"Chùa Từ Đàm là một trong những ngôi chùa linh thiêng và cổ kính bậc nhất ở cố đô Huế. Đến đây, bạn sẽ có những giây phút thư giãn, đắm chìm trong bầu không khí thanh bình, linh thiêng rời xa những ồn ào, náo nhiệt của cuộc sống.",0
1062,c1743bb50274bd2cec50a8af71ea1b74,Sài Gòn giải phóng,"Nhà đầu tư ‘giẫm đạp’ bán tháo, VN-Index giảm 57 điểm","Thông tin tiêu cực từ thị trường chứng khoán thế giới, cộng với việc Hòa Kỳ đưa Việt Nam trở lại danh sách giám sát tiền tệ, đã tạo bầu không khí hoảng loạn và dẫn đến đợt bán tháo kinh hoàng trong phiên hôm nay 13-6.",0
1063,db55d17ef8e1e0742838f1eec92991a2,TRAI NGHIEM SO,"Nhà đầu tư ‘giẫm đạp’ bán tháo, VN Index giảm 57 điểm","(ĐTTCO) - Thông tin tiêu cực từ thị trường chứng khoán thế giới, cộng với việc Hòa Kỳ đưa Việt Nam trở lại danh sách giám sát tiền tệ, đã tạo bầu không khí hoảng loạn và dẫn đến đợt bán tháo kinh hoàng trong phiên hôm nay 13-6.",0
1064,dcbb31317cc0b2a69bdcca82a204fb5f,"Bộ văn hoa, thể thao và du lịch",Triển vọng tích cực của du lịch toàn cầu,"Trong bối cảnh nhiều quốc gia, khu vực đang dần chuyển sang ""sống chung"" an toàn với Covid-19, chuỗi liên kết du lịch lữ hành quốc tế cũng được tái thiết mạnh mẽ, mở ra triển vọng phục hồi tích cực cho ngành công nghiệp không khói của nhiều nước trên thế giới.",0
1065,1a5f76261d2d69a3c580121179536748,Tuần báo văn nghệ,Từ núi Thạch Long tôi đi mang theo bóng làng trong kí ức bông râm bụt cứ nở hoài cơn mưa tháng sáu con rô đồng cắn đọt rau muống đêm trăng ngan ngát hương ngọc anh mưa xứ sở này buồn như giấc ngủ nghìn năm những ngôi mộ mọc tràn cỏ cầm chiếc lá lên tay tôi biết đình làng vừa vút lên tiếng vạc kêu sương mẹ cầm nhánh ca dao cấy xuống đất một lời ru da vàng vang vang tiếng tù và trên cánh đồng con bù nhìn thiền gió dưới mây hồng thế là hoang khói dòng trôi…,Từ núi Thạch Long tôi đi mang theo bóng làng trong kí ức bông râm bụt cứ nở hoài cơn mưa tháng sáu con rô đồng cắn đọt rau muống đêm trăng ngan ngát hương ngọc anh mưa xứ sở này buồn như giấc ngủ nghìn năm những ngôi mộ mọc tràn cỏ cầm chiếc lá lên tay tôi biết đình làng vừa vút lên tiếng vạc kêu sương mẹ cầm nhánh ca dao cấy xuống đất một lời ru da vàng vang vang tiếng tù và trên cánh đồng con bù nhìn thiền gió dưới mây hồng thế là hoang khói dòng trôi…,0
1066,eeee5c21797fe57b35b5e0ba826f8508,Người lao động,"CLIP: Kho container cháy 3 ngày không dập hết, khói độc bao trùm ở Bangladesh",(NLĐO) - Một vụ hỏa hoạn lớn xảy ra tại kho chứa container gần một thành phố cảng ở Đông Nam Bangladesh làm chết ít nhất 49 người và hơn 300 người bị thương.,-1
1067,a714b798e6ca11b8170e16878688a95b,cafebiz,"Dân số 10.000 nhưng GDP trên đầu người từng vượt xa cả Mỹ, điều gì khiến quốc gia nhỏ bé rơi vào cảnh ""cùng cực""?","Khi cơn sốt phốt phát qua đi, Nuaru, quốc đảo cô độc nằm giữa Thái Bình Dương, trở thành nạn nhân của chính mình với một nền kinh tế kiệt quệ cùng môi trường ô nhiễm nghiêm trọng.",0
1068,de5fa3c8d731ec74c035f118f01792e1,Nhân dân,"Từ ngày 1/5, Bắc Bộ và Bắc Trung Bộ chuyển lạnh","Theo Trung tâm Dự báo Khí tượng Thủy văn quốc gia, do ảnh hưởng của không khí lạnh, từ ngày 1/5, ở Bắc Bộ và Bắc Trung Bộ trời chuyển lạnh với nhiệt độ thấp nhất 18-21 độ C, vùng núi Bắc Bộ chuyển rét, nhiệt độ thấp nhất 16-18 độ C.",0
1069,639af2889c32b1ba35eec6083dc9e326,VietNam Plus,Bộ TN-MT ‘tăng tốc’ xử lý các điểm nóng ô nhiễm nguồn nước,"Trước thực trạng ô nhiễm nguồn nước tại nhiều lưu vực sông, đại diện Bộ Tài nguyên và Môi trường cho biết trong năm 2022, cơ quan này sẽ tăng cường việc giám sát xử lý dứt điểm các “điểm nóng.""",0
1070,c38cdb465ac4797cd2f9f7fcc1bec7ec,Báo Đồng Khởi Online,Mách bạn một số nhà xe cabin đi SaPa chất lượng nhất,"BDK.VN - Sapa nơi được mệnh danh là xứ sở sương mù, mảnh đất hứa của nhiều tín đồ du lịch. Nếu như bạn có ý định đến đây thì hãy tham khảo ngay những hãng xe cabin đi Sapa dưới đây. Chắc chắn những hãng xe này sẽ cho bạn những trải nghiệm thú vị nhất khi đến với Sapa.",0
1071,50a4b2d1deba957ae4ecea82d2a3a15a,Phòng không - không quân,Bộ Quốc phòng kiểm tra Dự án xử lý ô nhiễm dioxin khu vực Sân bay Biên Hòa,"Chiều 15-6, Đoàn công tác của Bộ Quốc phòng (BQP) do Thượng tướng Hoàng Xuân Chiến - Ủy viên BCH Trung ương Đảng, Thứ trưởng BQP làm trưởng đoàn đã đến kiểm tra thực hiện Dự án xử lý ô nhiễm dioxin khu vực Sân bay Biên Hòa giai đoạn 1. Tham gia đoàn kiểm tra có đồng chí Võ Tấn Đức - Phó Chủ tịch UBND tỉnh Đồng Nai; Trung tướng Phùng Sĩ Tấn - Phó Tổng Tham mưu trưởng QĐND Việt Nam; Thiếu tướng Bùi Anh Chung - Phó Tư lệnh Quân chủng Phòng không- Không quân (PK-KQ).",1
1072,7dd58e5d3f137481f8ebf37d4ee09ddb,Sở Tài nguyên và Môi trường Kon Tum,Xử phạt nặng với hành vi gây ô nhiễm môi trường trong sản xuất nông nghiệp,"Nghị định số 45/2022/NĐ-CP của Chính phủ vừa ban hành, quy định cụ thể về xử phạt vi phạm hành chính trong lĩnh vực bảo vệ môi trường trong sản xuất nông nghiệp.",1
1073,8bc8f83d329b412f53bd1eb6383dcf34,Kinh Te Moi Truong,"Xử phạt lên đến 150 triệu đồng đối với hành vi gây ô nhiễm đất, nước",Phó Thủ tướng Chính phủ Lê Văn Thành ký ban hành Nghị định số 45/2022/NĐ-CP quy định về xử phạt vi phạm hành chính trong lĩnh vực bảo vệ môi trường.,0
1074,d213d6438664e88221290ddd7ce4b770,Viettel Media,Hội An cấm cơ sở lưu trú cho khách dùng loa kẹo kéo hát hò,"Trước tình trạng các cơ sở lưu trú cho khách dùng loa kẹo kéo hát hò gây ô nhiễm tiếng ồn khiến người dân bức xúc, Hội An ra thông báo chấn chỉnh.",0
1075,6fca21489957f85234fbccab53ea9652,Xã luận,"Thái Bình: Ô nhiễm tại làng nghề Phương La gây bức xúc cho dân, chính quyền vất vả","Ông Trần Bá Cao, Chủ tịch UBND xã Thái Phương (Hưng Hà, Thái Bình) cho biết tình trạng ô nhiêm môi trường tại làng nghề dệt nhuộm Phương La gây bức xúc cho người dân, doanh nghiệp, còn chính quyền thì rất vất vả.",-1
1076,71b44222c86ddd84c1ab7da688791cbc,MOT THE GIOI ONLINE,Vật liệu nhãn dán đầu tiên trên thế giới được chứng nhận giúp giảm ô nhiễm nhựa đại dương,,0
1077,83f2309670d4eb672850aad1fe3122ee,24h,"8 cách thải độc phổi tự nhiên, F0 khỏi bệnh cũng nên áp dụng để cải thiện sức khoẻ","Môi trường ô nhiễm, thói quen sinh hoạt không lành mạnh là những nguyên nhân chính gây ra các vấn đề về phổi. Tuy nhiên, vẫn có một số cách để giữ cho lá phổi khoẻ mạnh. Cơ quan này có khả năng tự hồi phục một cách kì diệu nếu chúng ta biết cách.",0
1078,d30dea11f15da26fa7258415cd3dc72b,Báo điện tử trí thức trẻ - Tin tức nhanh nhất,Những mảng xanh làm 'mát lòng' người Sài Gòn trong ngày hè oi bức,"(Tổ Quốc) - Những công viên, con đường rợp bóng cây xanh luôn là ""thiên đường mùa hè"" với người dân TP.HCM bởi được hít thở không khí trong lành cũng là niềm hạnh phúc.",1
1079,44c90b53dc550223857e76e08b8e99af,Báo Thái Bình,Hưng Hà: Khẩn trương xử lý tình trạng ô nhiễm môi trường ở xã Minh Khai,"Trước phản ánh của bà con thôn Thanh Cách, xã Minh Khai (Hưng Hà) về tình trạng ô nhiễm môi trường do cơ sở sản xuất thạch rau câu (Công ty TNHH Công nghệ thực phẩm Hoa Sen) có dấu hiệu xả thải trực tiếp chưa qua xử lý ra môi trường làm ảnh hưởng đến sinh hoạt và sức khỏe của nhân dân, UBND huyện Hưng Hà đã chỉ đạo các phòng, ban, ngành liên quan khẩn trương xuống hiện trường nắm bắt xử lý tình trạng này.",-1
1080,9388b4ec0db1f585fac62decc36ff854,vnexpress,Trực thăng bay thấp đưa ngư dân đột quỵ về đất liền,"TP HCMBệnh nhân bị phù não do đột quỵ, nếu máy bay lên cao áp suất không khí giảm sẽ làm phù não nặng hơn nên bác sĩ đề nghị phi công bay tầm thấp.",0
1081,68452cf7f8144c3fc35649f11ee87b38,Dich vu Vinaphone,Nan giải tình trạng ô nhiễm rác thải ở nhiều địa phương ven biển Quảng Ngãi,"Nhiều địa phương ven biển của tỉnh Quảng Ngãi có tình trạng rác thải tràn lan trên các bãi biển dọc theo khu dân cư, ảnh hưởng đến đời sống của người dân và cảnh quan môi trường, hệ sinh thái biển.


",-1
1082,7a196dd01e19d7e6dd4f6bf27fe2944a,Tây Ninh Online,Nhân ngày gia đình Việt Nam 28.6: Gia đình là nơi sẻ chia,"BTN - Cảm nhận không khí gia đình với nhiều yêu thương, đầm ấm là mong muốn của nhiều người, nhất là sau những lo âu, trở ngại từ đợt dịch vừa qua. Đi qua những khó khăn, mọi người như thêm quý trọng hơn tình cảm gia đình.",0
1083,825069614df7c63b15e78a02f6cd0e61,Thừa thiên Huế Online,Châu Á tăng gấp 4 lần tài chính cho các dự án chống ô nhiễm,"TTH - Tạp chí Nikkei Asia ngày 15/4 trích dẫn số liệu thống kê của Trang dữ liệu tài chính môi trường Ef Data cho hay, châu Á đã vượt qua châu Âu về hoạt động cho vay đối với các dự án được thiết kế nhằm trực tiếp giảm thiểu ô nhiễm môi trường. Trong năm 2021, 56 tỷ USD đã được dành cho những dự án này, đánh dấu mức tăng hơn gấp 4 lần so với một năm trước đó.",-1
1084,fca445748c2f92601235683f9355697b,Báo điện tử trí thức trẻ - Tin tức nhanh nhất,"Video cận cảnh quá trình giải cứu bé trai mắc kẹt trong căn hộ chung cư bốc cháy ở Lĩnh Nam, Hà Nội","(Tổ Quốc) - Chạy bộ 20 tầng, vượt khói lửa bao trùm... các chiến sĩ PCCC&CNCH - Công an quận Hai Bà Trưng đã giải cứu an toàn bé trai mắc kẹt trong căn hộ bốc cháy khiến nhiều người vỡ oà vì xúc động...",0
1085,0d18c6d9c5539c3c0602523932884024,Kinh Te Moi Truong,Bà Rịa – Vũng Tàu mạnh tay xử phạt hành vi gây ô nhiễm môi trường,"Mới đây, UBND tỉnh Bà Rịa – Vũng Tàu đã ban hành quyết định xử phạt với số tiền hơn 290 triệu đồng đối với hai cá nhân cùng ngụ huyện Long Điền do thực hành vi xả thải gây ô nhiễm môi trường.",1
1086,ad384b7248716685a310d7c76ca72a52,VietNam Plus,Bộ trưởng Môi trường Anh Alok Sharma để ngỏ khả năng từ chức,"Khi được hỏi về khả năng từ chức nếu các ứng cử viên không quyết tâm thực hiện mục tiêu trung hòa khí thải carbon, ông Alok Sharma cho biết điều này tùy thuộc vào việc ai sẽ là Thủ tướng Anh.",0
1087,acfd6f1c37097ae40b759e56809e548f,Dich vu Vinaphone,Robot cá có thể 'ăn' vi nhựa trong đại dương,"Các nhà khoa học tại Đại học Tứ Xuyên (Trung Quốc) đã phát triển được một robot cá có khả năng hút những mảnh vi nhựa trôi nổi dưới đại dương, trong tương lai có thể giúp giải quyết tình trạng ô nhiễm biển.",0
1088,b1ad12567a37467c611738eb1f37817e,Đầu tư online,Đà Nẵng nói gì về việc nạo vét bùn Âu thuyền Thọ Quang rồi nhận chìm?,"Giám đốc Sở Tài nguyên và Môi trường Đà Nẵng khẳng định việc nạo vét, nhận chìm để giải quyết vấn nạn ô nhiễm tại Âu thuyền Thọ Quang được làm ""hết sức thận trọng"".",0
1089,5b75f45dc59ea8650197949ec53198f6,VietNam Plus,Bộ TN-MT sẽ quản chặt các nguồn phát thải khí ‘làm bẩn’ môi trường,"Với việc đầu tư, lắp đặt, vận hành hệ thống truyền số liệu quan trắc khí thải tự động liên tục, kết nối từ cơ sở đến Bộ Tài nguyên Môi trường, các nguồn phát thải khí thải sẽ được kiểm soát chặt hơn.",1
1090,ca0d4e586770338a805bd60c408f781d,Báo Nam Định,Trồng rau trong nhà kính dưới đáy biển,"Dự án có tên Vườn Nemo là nhà kính dưới nước đầu tiên và duy nhất trên thế giới. Vườn Nemo tận dụng chất lượng môi trường thuận lợi dưới biển như nhiệt độ ổn định, hấp thụ CO2, kiểm soát sâu bệnh tự nhiên để tạo ra môi trường phù hợp nhằm sản xuất hàng loạt rau sạch, theo Euronews Green. Báo Nam Định điện tử, cơ quan của Đảng bộ Đảng Cộng sản Việt Nam, tiếng nói của Đảng bộ, chính quyền, và nhân dân Nam Định",1
1091,a485a7a88a5c526c9c23f10277ed3fcf,genk.vn,"Dân số 10.000 nhưng GDP trên đầu người từng vượt xa cả Mỹ, điều gì khiến quốc gia nhỏ bé rơi vào cảnh 'cùng cực'?","(Tổ Quốc) - Khi cơn sốt phốt phát qua đi, Nuaru, quốc đảo cô độc nằm giữa Thái Bình Dương, trở thành nạn nhân của chính mình với một nền kinh tế kiệt quệ cùng môi trường ô nhiễm nghiêm trọng.",0
1092,919bfc06e90097e9a5ad3b0ce7eaf5b7,VietNam Plus,Algeria và Trung Quốc ký hợp đồng thăm dò dầu khí tại mỏ Zarzaitine,"SOOGL và Sonatrach sẽ hợp tác trong việc khoan các giếng mới, bổ sung cho các giếng hiện có, cải tạo các cơ sở dầu khí và giảm lượng khí thải carbon.",0
1093,257ea8c9215ae65570f362e224a862d0,cafebiz,Đợt không khí lạnh ở miền Bắc kéo dài bao lâu?,"Do ảnh hưởng của không khí lạnh, nền nhiệt các tỉnh miền Bắc và Bắc Trung Bộ giảm mạnh từ hôm nay (1/5). Nền nhiệt thấp duy trì tới khoảng ngày 4/5, sau đó tăng dần.",0
1094,97cc87152eae1c16560fc7e1589e1b9b,VietNam Plus,Không khí lạnh tăng cường gây mưa dông khu vực Bắc Bộ và Trung Bộ,"Do ảnh hưởng của không khí lạnh kết hợp với hội tụ gió trên mực 1500m nên từ ngày 16/4 đến ngày 18/4, ở Bắc Bộ và Bắc Trung Bộ có mưa rào và dông, cục bộ có mưa vừa, mưa to.",0
1095,8b1f62798511007610331bf642585a45,Đời sống Việt Nam,"Không khí lạnh tăng cường, gây mưa rào và dông ở Bắc Bộ và Bắc Trung Bộ","Do ảnh hưởng của không khí lạnh kết hợp với hội tụ gió trên mực 1500m nên từ đêm 15/4 đến ngày 18/4, ở Bắc Bộ và Bắc Trung Bộ có mưa rào và dông, cục bộ có mưa vừa, mưa to.",0
1096,d8ef388ee9d2620893d7a3b6e5a86098,Hà Nội mới,Nhiều vi phạm trật tự đô thị tại phường Bưởi chưa được xử lý,"(HNM) - Tại khu vực các phố: Võng Thị, Trích Sài, Hoàng Hoa Thám (đoạn thông sang phố Lạc Long Quân) và ngõ 530 phố Thụy Khuê thuộc phường Bưởi (quận Tây Hồ), vi phạm trật tự đô thị diễn ra tràn lan. Người dân bức xúc vì vỉa hè bị một số hộ dân chiếm dụng bày bán hàng, lòng đường bị biến thành bãi đỗ xe, trong khi điểm kinh doanh vật liệu xây dựng thường xuyên gây ô nhiễm môi trường..., nhưng không được lực lượng chức năng xử lý.",-1
1097,cd390c6094df783a2b7edcb2fb6b0554,Báo Sơn La điện tử,"""Sức nóng"" của du lịch dịp nghỉ lễ","Tiếp nối kỳ nghỉ lễ Giỗ Tổ Hùng Vương, thị trường du lịch dịp nghỉ lễ 30/4 và 1/5 năm nay dự kiến sẽ thu hút đông khách trở lại. Ðây được xem là cú huých mạnh mẽ góp phần làm hồi sinh nhanh chóng ""ngành công nghiệp không khói"" nước nhà sau thời gian dài chịu ảnh hưởng nặng nề của dịch Covid-19.",0
1098,9163671c1aa0a842b462aa63559cfa97,Kinh Te Moi Truong,Giám đốc Sở GTVT Yên Bái trả lời cử tri về tình trạng xe quá tải gây ô nhiễm môi trường,"Giám đốc Sở Giao thông Vận tải tỉnh Yên Bái - Đỗ Việt Bách cho biết sẽ tăng cường tuần tra, kiểm soát nhằm giảm thiểu tình trạng xe quá tải, quá khổ tham gia giao thông.",0
1099,dcc352bf54ebc73d6b22effb3cc44287,Báo Cần Thơ Online,Gameshow góp phần quảng bá du lịch,"Gần đây, loại hình gameshow truyền hình di chuyển, trải nghiệm kết hợp trò chơi vận động ngày càng nở rộ. Bên cạnh tính giải trí, việc các gameshow chú trọng khai thác tiềm năng du lịch, bản sắc văn hóa địa phương đã góp phần quảng bá du lịch trong bối cảnh cả nước đang tập trung hồi phục, phát triển ngành “công nghiệp không khói” này.",0
1100,eacdbabcdefc61048e254b2e65115929,VietNam Plus,Xử lý nước thải sinh hoạt đô thị: Người gây ô nhiễm phải trả tiền?,"Theo các chuyên gia, để cải thiện việc xử lý nước thải tại các đô thị, giải pháp cấp thiết hiện nay là cần thay đổi chính sách theo hướng xã hội hoá, theo nguyên tắc người gây ô nhiễm phải trả tiền.",0
1101,db6eeac948850c1ef6ff8099c8900c6d,Dich vu Vinaphone,Di dời các cơ sở chế biến hải sản để phát triển bền vững,"Việc chế biến hải sản nhỏ, lẻ trong khu dân cư, nằm ngoài vùng quy hoạch thời gian qua đã gây ô nhiễm môi trường nghiêm trọng tại các địa phương trên địa bàn huyện Đất Đỏ, tỉnh Bà Rịa-Vũng Tàu. ",1
